;document;siape;das;context
19;PORTARIA DIDES Nº 19, DE 8 DE FEVEREIRO DE 2023Nº 19;;;Conceder aposentadoria voluntária ao servidor GILMAR OLIVEIRA BRENTINI Auxiliar Técnico, AT-NI-S-IV, do Quadro de Pessoal desta Fundação, matrícula SIAPE nº XX650XX, com fundamento no art. 20, § 2º, da Emenda Constitucional nº 103, de 12 de novembro de 2019, declarando em decorrência a vacância do cargo (processo nº 03001.000453/2023-19).
20;PORTARIA IPEA Nº 22, DE 10 DE FEVEREIRO DE 2023Nº 22;;;Art. 1º Ceder o servidor RODRIGO OCTÁVIO ORAIR, Matrícula SIAPE nº XX051XX, ocupante do cargo de Técnico de Planejamento e Pesquisa, pertencente ao Quadro de Pessoal da Fundação Instituto de Pesquisa Econômica Aplicada - IPEA, para exercer cargo comissionado de Diretor de Programa da Secretaria Extraordinária de Reformas Tributárias, código CCE 3.15, do Ministério da Fazenda.
21;PORTARIA IPEA Nº 23, DE 10 DE FEVEREIRO DE 2023Nº 23;;;Art. 1º Reverter a aposentadoria voluntária concedida a servidora ILMA TAVARES DE SOUZA, matrícula SIAPE nº XX692XX, Cargo de Auxiliar Técnico, Nível Intermediário, Classe S, Padrão IV, a qual deverá retornar à atividade neste mesmo cargo.
22;PORTARIA DE PESSOAL SE/ MPO Nº 69, DE 10 DE FEVEREIRO DE 2023Nº 69;SIAPE nº 1283261;;"Designar o servidor FERNANDO GAIGER SILVEIRA, matrícula SIAPE nº 1283261, para exercer o encargo de substituto eventual do cargo em comissão de Diretor, código FCE 1.15, da Diretoria de Desenvolvimento Institucional, do Instituto de Pesquisa Econômica Aplicada - IPEA , nos afastamentos, impedimentos legais ou regulamentares do titular e na vacância do cargo;"
23;PORTARIA DIDES Nº 20, DE 10 DE FEVEREIRO DE 2023Nº 20;;;"Conceder pensão civil a Vanderly Brito de Araújo, cônjuge do servidor Roberto Rodrigues Corrêa de Araújo, aposentado no cargo de Técnico de Planejamento e Pesquisa, Código 403020, Classe S, Padrão IV, matrícula SIAPE XX771XX, com fundamento nos artigos 215, 217, inciso I, e 222, inciso VII, alínea ""b"", item 6, da Lei n.º 8.112/1990, alterada pela Lei n.º 13.135/2015, c/c os artigos 23 e 24 da Emenda Constitucional 103/2019 e com o artigo 15 da Lei n.º 10.887/2004, com vigência a partir de 25 de janeiro de 2023, data do falecimento do servidor."
